{
  "$schema": "https://json-schema.org/draft/2020-12/schema",
  "$id": "https://pqctoday.com/schemas/acvp/evidence.v1.schema.json",
  "title": "PQC Today ACVP-format prototype — evidence sidecar (evidence.json), version 1 (FROZEN)",
  "$comment": "PQC Today's own schema, independent of the ACVP response schemas. Carries run metadata only — never vector payloads (prompt/response are identified by SHA-256). evidenceClass is nist-acvp-reference-sample only when the prompt bytes hash-match a pinned public NIST ACVP-Server sample (src/services/acvp/__fixtures__/nist-acvp-server/PROVENANCE.json); anything else is unverified-imported-vector-set. FROZEN — pqctoday.acvp-evidence/1 exactly as produced before 2026-09-24 WS-F externalMu (hub 0214acac5). Never edit: frozen evidence runs (e.g. evidence/acvp-xplat/2026-09-24) validate against it forever; any change to the evidence shape is a NEW version file registered in evidenceSchemas.ts.",
  "type": "object",
  "additionalProperties": false,
  "required": [
    "evidenceVersion",
    "label",
    "disclaimers",
    "evidenceClass",
    "generator",
    "prompt",
    "response",
    "engine",
    "startedAt",
    "finishedAt",
    "summary",
    "cases",
    "unsupported",
    "goldenComparison"
  ],
  "properties": {
    "evidenceVersion": { "const": "pqctoday.acvp-evidence/1" },
    "label": { "const": "ACVP-format compatible prototype" },
    "disclaimers": { "type": "array", "minItems": 2, "items": { "type": "string" } },
    "evidenceClass": { "enum": ["nist-acvp-reference-sample", "unverified-imported-vector-set"] },
    "generator": {
      "type": "object",
      "additionalProperties": false,
      "required": ["name", "codePath", "appVersion", "irVersion"],
      "properties": {
        "name": { "type": "string" },
        "codePath": { "enum": ["browser", "cli"] },
        "appVersion": { "type": ["string", "null"] },
        "irVersion": { "const": "pqctoday.acvp-ir/1" }
      }
    },
    "prompt": {
      "type": "object",
      "additionalProperties": false,
      "required": [
        "sha256",
        "knownPublicFixture",
        "framing",
        "acvVersion",
        "vsId",
        "algorithm",
        "mode",
        "revision",
        "isSample",
        "pinnedSchema"
      ],
      "properties": {
        "sha256": { "$ref": "#/$defs/sha256" },
        "knownPublicFixture": {
          "type": ["object", "null"],
          "additionalProperties": false,
          "required": ["repository", "commit", "upstreamPath"],
          "properties": {
            "repository": { "type": "string" },
            "commit": { "type": "string" },
            "upstreamPath": { "type": "string" }
          }
        },
        "framing": { "enum": ["envelope", "bare"] },
        "acvVersion": { "type": ["string", "null"] },
        "vsId": { "type": "integer", "minimum": 0 },
        "algorithm": { "type": "string" },
        "mode": { "type": "string" },
        "revision": { "type": "string" },
        "isSample": { "type": ["boolean", "null"] },
        "pinnedSchema": {
          "type": "object",
          "additionalProperties": false,
          "required": [
            "id",
            "promptSchemaFile",
            "responseSchemaFile",
            "specRepository",
            "specCommit",
            "specDocument"
          ],
          "properties": {
            "id": { "type": "string" },
            "promptSchemaFile": { "type": "string" },
            "responseSchemaFile": { "type": "string" },
            "specRepository": { "type": "string" },
            "specCommit": { "type": "string" },
            "specDocument": { "type": "string" }
          }
        }
      }
    },
    "response": {
      "type": "object",
      "additionalProperties": false,
      "required": ["fileName", "sha256"],
      "properties": {
        "fileName": { "const": "response.json" },
        "sha256": { "$ref": "#/$defs/sha256" }
      }
    },
    "engine": {
      "type": "object",
      "additionalProperties": false,
      "required": [
        "id",
        "label",
        "implementation",
        "softhsmProductVersion",
        "provenanceBundle",
        "hsmCommit",
        "builtAt",
        "artifactPath",
        "artifactSha256",
        "artifactSha256Note"
      ],
      "properties": {
        "id": { "type": "string" },
        "label": { "type": "string" },
        "implementation": { "type": "string" },
        "softhsmProductVersion": { "type": ["string", "null"] },
        "provenanceBundle": { "type": ["string", "null"] },
        "hsmCommit": { "type": ["string", "null"] },
        "builtAt": { "type": ["string", "null"] },
        "artifactPath": { "type": ["string", "null"] },
        "artifactSha256": {
          "type": ["string", "null"],
          "pattern": "^[0-9a-f]{64}$"
        },
        "artifactSha256Note": { "type": "string" }
      }
    },
    "startedAt": { "$ref": "#/$defs/timestamp" },
    "finishedAt": { "$ref": "#/$defs/timestamp" },
    "summary": {
      "type": "object",
      "additionalProperties": false,
      "required": ["testCases", "answered", "unsupported", "error"],
      "properties": {
        "testCases": { "type": "integer", "minimum": 0 },
        "answered": { "type": "integer", "minimum": 0 },
        "unsupported": { "type": "integer", "minimum": 0 },
        "error": { "type": "integer", "minimum": 0 }
      }
    },
    "cases": {
      "type": "array",
      "items": {
        "type": "object",
        "additionalProperties": false,
        "required": ["tgId", "tcId", "disposition"],
        "properties": {
          "tgId": { "type": "integer", "minimum": 0 },
          "tcId": { "type": "integer", "minimum": 0 },
          "disposition": { "enum": ["answered", "unsupported", "error"] },
          "reason": { "type": "string" },
          "detail": { "type": "string" }
        }
      }
    },
    "unsupported": {
      "type": "array",
      "items": {
        "type": "object",
        "additionalProperties": false,
        "required": ["tgId", "scope", "reason", "tcIds"],
        "properties": {
          "tgId": { "type": "integer", "minimum": 0 },
          "scope": { "enum": ["group", "test", "engine"] },
          "reason": { "type": "string" },
          "tcIds": { "type": "array", "minItems": 1, "items": { "type": "integer" } }
        }
      }
    },
    "goldenComparison": {
      "type": ["object", "null"],
      "additionalProperties": false,
      "required": ["matched", "mismatched", "unanswered", "unexpected", "expectedTotal"],
      "properties": {
        "matched": { "type": "integer", "minimum": 0 },
        "mismatched": { "type": "integer", "minimum": 0 },
        "unanswered": { "type": "integer", "minimum": 0 },
        "unexpected": { "type": "integer", "minimum": 0 },
        "expectedTotal": { "type": "integer", "minimum": 0 }
      }
    }
  },
  "$defs": {
    "sha256": { "type": "string", "pattern": "^[0-9a-f]{64}$" },
    "timestamp": {
      "type": "string",
      "pattern": "^\\d{4}-\\d{2}-\\d{2}T\\d{2}:\\d{2}:\\d{2}(\\.\\d+)?Z$"
    }
  }
}
