{
  "evidenceVersion": "pqctoday.acvp-evidence/1",
  "label": "ACVP-format compatible prototype",
  "disclaimers": [
    "PQC Today executes selected public reference vectors, standards tests, conformance cases, and implementation probes. A passing result is evidence only for the identified test, operation, parameters, implementation build, and target. It is not an ACVTS verdict, a CAVP/CMVP certificate, or proof of exhaustive conformance.",
    "Import and response generation do not submit results to NIST and do not establish validation. The laboratory or authorized submitter remains responsible for the ACVTS session and submission."
  ],
  "evidenceClass": "nist-acvp-reference-sample",
  "generator": {
    "name": "PQC Today acvp-native runner (Python/ctypes) executing the hub-generated plan.json",
    "codePath": "cli",
    "appVersion": null,
    "irVersion": "pqctoday.acvp-ir/1"
  },
  "prompt": {
    "sha256": "e2cba4589389756fa0bea1a7e6837138bf0a81f9d14234c9ee8f6d33caa1654e",
    "knownPublicFixture": {
      "repository": "https://github.com/usnistgov/ACVP-Server",
      "commit": "975de31eb83d87039ec88934fdc47d8c312b892d",
      "upstreamPath": "gen-val/json-files/ML-DSA-sigVer-FIPS204/prompt.json"
    },
    "framing": "bare",
    "acvVersion": null,
    "vsId": 42,
    "algorithm": "ML-DSA",
    "mode": "sigVer",
    "revision": "FIPS204",
    "isSample": false,
    "pinnedSchema": {
      "id": "ML-DSA/sigVer/FIPS204",
      "promptSchemaFile": "src/services/acvp/schemas/ml-dsa-sigver-fips204.prompt.schema.json",
      "responseSchemaFile": "src/services/acvp/schemas/ml-dsa-sigver-fips204.response.schema.json",
      "specRepository": "https://github.com/usnistgov/ACVP",
      "specCommit": "892fd14710f3a7edbea230d0aecc5511e0257f8e",
      "specDocument": "draft-celi-acvp-ml-dsa (src/draft-celi-acvp-ml-dsa.adoc)"
    }
  },
  "response": {
    "fileName": "response.json",
    "sha256": "12197a1d206955f643a7f8d2e5fd63f5fb7ab7a06d9bfe2f6a20b34697eb1ee7"
  },
  "engine": {
    "id": "cpp",
    "label": "softhsmv3 C++ engine (native)",
    "implementation": "pqctoday-hsm softhsmv3 C++ (OpenSSL 3.6 backend), native shared library libsofthsmv3.so",
    "softhsmProductVersion": "3.0",
    "provenanceBundle": null,
    "hsmCommit": "7795799b91c61097cb6cd28704c0ca1ab114a4c7",
    "builtAt": "2026-09-25T02:42Z",
    "artifactPath": "/tmp/acvp-h-9241/build-cpp/src/lib/libsofthsmv3.so",
    "artifactSha256": "ba5d00acf9a44a3937420e09d11700616a4ae966ce2976457ce257cf1f0ab3a9",
    "artifactSha256Note": "SHA-256 of the exact shared library bytes dlopen()ed for this run; hsmCommit/builtAt from --build-info."
  },
  "startedAt": "2026-09-25T03:10:28.007Z",
  "finishedAt": "2026-09-25T03:10:28.018Z",
  "summary": {
    "testCases": 180,
    "answered": 82,
    "unsupported": 98,
    "error": 0
  },
  "cases": [
    {
      "tgId": 1,
      "tcId": 1,
      "disposition": "answered",
      "detail": "CKR_SIGNATURE_INVALID"
    },
    {
      "tgId": 1,
      "tcId": 2,
      "disposition": "answered",
      "detail": "CKR_SIGNATURE_INVALID"
    },
    {
      "tgId": 1,
      "tcId": 3,
      "disposition": "answered"
    },
    {
      "tgId": 1,
      "tcId": 4,
      "disposition": "answered",
      "detail": "CKR_SIGNATURE_INVALID"
    },
    {
      "tgId": 1,
      "tcId": 5,
      "disposition": "answered",
      "detail": "CKR_SIGNATURE_INVALID"
    },
    {
      "tgId": 1,
      "tcId": 6,
      "disposition": "answered",
      "detail": "CKR_SIGNATURE_INVALID"
    },
    {
      "tgId": 1,
      "tcId": 7,
      "disposition": "answered",
      "detail": "CKR_SIGNATURE_INVALID"
    },
    {
      "tgId": 1,
      "tcId": 8,
      "disposition": "answered",
      "detail": "CKR_SIGNATURE_INVALID"
    },
    {
      "tgId": 1,
      "tcId": 9,
      "disposition": "answered",
      "detail": "CKR_SIGNATURE_INVALID"
    },
    {
      "tgId": 1,
      "tcId": 10,
      "disposition": "answered",
      "detail": "CKR_SIGNATURE_INVALID"
    },
    {
      "tgId": 1,
      "tcId": 11,
      "disposition": "answered"
    },
    {
      "tgId": 1,
      "tcId": 12,
      "disposition": "answered",
      "detail": "CKR_SIGNATURE_INVALID"
    },
    {
      "tgId": 1,
      "tcId": 13,
      "disposition": "answered",
      "detail": "CKR_SIGNATURE_INVALID"
    },
    {
      "tgId": 1,
      "tcId": 14,
      "disposition": "answered",
      "detail": "CKR_SIGNATURE_INVALID"
    },
    {
      "tgId": 1,
      "tcId": 15,
      "disposition": "answered"
    },
    {
      "tgId": 2,
      "tcId": 16,
      "disposition": "answered",
      "detail": "CKR_SIGNATURE_INVALID"
    },
    {
      "tgId": 2,
      "tcId": 17,
      "disposition": "answered",
      "detail": "CKR_SIGNATURE_INVALID"
    },
    {
      "tgId": 2,
      "tcId": 18,
      "disposition": "answered",
      "detail": "CKR_SIGNATURE_INVALID"
    },
    {
      "tgId": 2,
      "tcId": 19,
      "disposition": "answered",
      "detail": "CKR_SIGNATURE_INVALID"
    },
    {
      "tgId": 2,
      "tcId": 20,
      "disposition": "answered",
      "detail": "CKR_SIGNATURE_INVALID"
    },
    {
      "tgId": 2,
      "tcId": 21,
      "disposition": "unsupported",
      "reason": "hashAlg \"SHA2-512/256\" has no PKCS#11 v3.2 CKM_HASH_ML_DSA_* mechanism (only SHA2-224/256/384/512, SHA3-224/256/384/512, SHAKE-128/256 do)."
    },
    {
      "tgId": 2,
      "tcId": 22,
      "disposition": "answered",
      "detail": "CKR_SIGNATURE_INVALID"
    },
    {
      "tgId": 2,
      "tcId": 23,
      "disposition": "unsupported",
      "reason": "hashAlg \"SHA2-512/256\" has no PKCS#11 v3.2 CKM_HASH_ML_DSA_* mechanism (only SHA2-224/256/384/512, SHA3-224/256/384/512, SHAKE-128/256 do)."
    },
    {
      "tgId": 2,
      "tcId": 24,
      "disposition": "answered",
      "detail": "CKR_SIGNATURE_INVALID"
    },
    {
      "tgId": 2,
      "tcId": 25,
      "disposition": "answered"
    },
    {
      "tgId": 2,
      "tcId": 26,
      "disposition": "answered",
      "detail": "CKR_SIGNATURE_INVALID"
    },
    {
      "tgId": 2,
      "tcId": 27,
      "disposition": "answered"
    },
    {
      "tgId": 2,
      "tcId": 28,
      "disposition": "answered",
      "detail": "CKR_SIGNATURE_INVALID"
    },
    {
      "tgId": 2,
      "tcId": 29,
      "disposition": "unsupported",
      "reason": "hashAlg \"SHA2-512/224\" has no PKCS#11 v3.2 CKM_HASH_ML_DSA_* mechanism (only SHA2-224/256/384/512, SHA3-224/256/384/512, SHAKE-128/256 do)."
    },
    {
      "tgId": 2,
      "tcId": 30,
      "disposition": "answered",
      "detail": "CKR_SIGNATURE_INVALID"
    },
    {
      "tgId": 3,
      "tcId": 31,
      "disposition": "answered",
      "detail": "CKR_SIGNATURE_INVALID"
    },
    {
      "tgId": 3,
      "tcId": 32,
      "disposition": "answered",
      "detail": "CKR_SIGNATURE_INVALID"
    },
    {
      "tgId": 3,
      "tcId": 33,
      "disposition": "answered"
    },
    {
      "tgId": 3,
      "tcId": 34,
      "disposition": "answered",
      "detail": "CKR_SIGNATURE_INVALID"
    },
    {
      "tgId": 3,
      "tcId": 35,
      "disposition": "answered",
      "detail": "CKR_SIGNATURE_INVALID"
    },
    {
      "tgId": 3,
      "tcId": 36,
      "disposition": "answered",
      "detail": "CKR_SIGNATURE_INVALID"
    },
    {
      "tgId": 3,
      "tcId": 37,
      "disposition": "answered",
      "detail": "CKR_SIGNATURE_INVALID"
    },
    {
      "tgId": 3,
      "tcId": 38,
      "disposition": "answered",
      "detail": "CKR_SIGNATURE_INVALID"
    },
    {
      "tgId": 3,
      "tcId": 39,
      "disposition": "answered",
      "detail": "CKR_SIGNATURE_INVALID"
    },
    {
      "tgId": 3,
      "tcId": 40,
      "disposition": "answered",
      "detail": "CKR_SIGNATURE_INVALID"
    },
    {
      "tgId": 3,
      "tcId": 41,
      "disposition": "answered",
      "detail": "CKR_SIGNATURE_INVALID"
    },
    {
      "tgId": 3,
      "tcId": 42,
      "disposition": "answered",
      "detail": "CKR_SIGNATURE_INVALID"
    },
    {
      "tgId": 3,
      "tcId": 43,
      "disposition": "answered"
    },
    {
      "tgId": 3,
      "tcId": 44,
      "disposition": "answered"
    },
    {
      "tgId": 3,
      "tcId": 45,
      "disposition": "answered",
      "detail": "CKR_SIGNATURE_INVALID"
    },
    {
      "tgId": 4,
      "tcId": 46,
      "disposition": "answered"
    },
    {
      "tgId": 4,
      "tcId": 47,
      "disposition": "answered",
      "detail": "CKR_SIGNATURE_INVALID"
    },
    {
      "tgId": 4,
      "tcId": 48,
      "disposition": "answered",
      "detail": "CKR_SIGNATURE_INVALID"
    },
    {
      "tgId": 4,
      "tcId": 49,
      "disposition": "answered",
      "detail": "CKR_SIGNATURE_INVALID"
    },
    {
      "tgId": 4,
      "tcId": 50,
      "disposition": "unsupported",
      "reason": "hashAlg \"SHA2-512/256\" has no PKCS#11 v3.2 CKM_HASH_ML_DSA_* mechanism (only SHA2-224/256/384/512, SHA3-224/256/384/512, SHAKE-128/256 do)."
    },
    {
      "tgId": 4,
      "tcId": 51,
      "disposition": "answered",
      "detail": "CKR_SIGNATURE_INVALID"
    },
    {
      "tgId": 4,
      "tcId": 52,
      "disposition": "answered"
    },
    {
      "tgId": 4,
      "tcId": 53,
      "disposition": "answered",
      "detail": "CKR_SIGNATURE_INVALID"
    },
    {
      "tgId": 4,
      "tcId": 54,
      "disposition": "answered"
    },
    {
      "tgId": 4,
      "tcId": 55,
      "disposition": "unsupported",
      "reason": "hashAlg \"SHA2-512/256\" has no PKCS#11 v3.2 CKM_HASH_ML_DSA_* mechanism (only SHA2-224/256/384/512, SHA3-224/256/384/512, SHAKE-128/256 do)."
    },
    {
      "tgId": 4,
      "tcId": 56,
      "disposition": "answered",
      "detail": "CKR_SIGNATURE_INVALID"
    },
    {
      "tgId": 4,
      "tcId": 57,
      "disposition": "answered",
      "detail": "CKR_SIGNATURE_INVALID"
    },
    {
      "tgId": 4,
      "tcId": 58,
      "disposition": "unsupported",